[
  {
    "id": "sig-001",
    "founder_ids": ["fndr-0001"],
    "company_ids": ["co-0001"],
    "source": "deck",
    "url": null,
    "observed_at": "2026-07-17T14:02:00Z",
    "ingested_at": "2026-07-17T14:02:31Z",
    "summary": "Deck page 7: '3,100 active installations across 240 organizations'. Deck page 9: '$18k MRR, +40% MoM for 3 months'. No external corroboration attached.",
    "raw_ref": "decks/ferrite-2026-07.pdf",
    "trust_tier": "claimed",
    "authority": "subject",
    "dedupe_key": "deck:ferrite:2026-07",
    "contradicts": ["sig-004"]
  },
  {
    "id": "sig-002",
    "founder_ids": ["fndr-0001"],
    "company_ids": ["co-0001"],
    "source": "github",
    "url": "https://github.com/example/ferrite",
    "observed_at": "2026-07-15T09:00:00Z",
    "ingested_at": "2026-07-16T03:11:08Z",
    "summary": "Repository: 412 stars, 61 forks, 9 external contributors. 1,400 commits over 11 months, 86% by the founder. Weekly release cadence for the last 20 weeks. CI config shows real test coverage.",
    "raw_ref": "archive/github-ferrite-2026-07-16.json",
    "trust_tier": "verified-online",
    "authority": "independent",
    "dedupe_key": "github.com/example/ferrite",
    "contradicts": []
  },
  {
    "id": "sig-003",
    "founder_ids": ["fndr-0001"],
    "company_ids": ["co-0001"],
    "source": "hackathon",
    "url": "https://example-hacknation.dev/winners-2026",
    "observed_at": "2026-05-11T00:00:00Z",
    "ingested_at": "2026-07-16T03:12:44Z",
    "summary": "Winner, infrastructure track, Hack-Nation Global AI Hackathon May 2026 — 'Ferrite: content-addressed caching for agent CI'. Judged field of ~400 teams.",
    "raw_ref": "archive/hacknation-winners-2026.html",
    "trust_tier": "verified-online",
    "authority": "independent",
    "dedupe_key": "hacknation-2026:ferrite",
    "contradicts": []
  },
  {
    "id": "sig-004",
    "founder_ids": ["fndr-0001"],
    "company_ids": ["co-0001"],
    "source": "registry",
    "url": "https://registry.example.dev/package/ferrite-cache",
    "observed_at": "2026-07-14T00:00:00Z",
    "ingested_at": "2026-07-16T03:14:02Z",
    "summary": "Public package registry: 340 downloads/week, 2,900 downloads total lifetime. Tension with deck's '3,100 active installations' — lifetime downloads are below the claimed active-install count.",
    "raw_ref": "archive/registry-ferrite-cache-2026-07-16.json",
    "trust_tier": "verified-online",
    "authority": "independent",
    "dedupe_key": "registry:ferrite-cache",
    "contradicts": ["sig-001"]
  },
  {
    "id": "sig-005",
    "founder_ids": ["fndr-0001"],
    "company_ids": ["co-0001"],
    "source": "social",
    "url": "https://example-social.com/maravoss/launch-post",
    "observed_at": "2026-06-02T16:40:00Z",
    "ingested_at": "2026-07-16T03:15:30Z",
    "summary": "Launch post, 2nd June: front page of a major aggregator for ~6 hours, 214 points, 89 comments. Founder answered 41 comments in-thread with technical depth; three commenters identified themselves as production users.",
    "raw_ref": "archive/launch-post-2026-06-02.html",
    "trust_tier": "verified-online",
    "authority": "independent",
    "dedupe_key": "launch:ferrite:2026-06-02",
    "contradicts": []
  },
  {
    "id": "sig-006",
    "founder_ids": ["fndr-0001"],
    "company_ids": [],
    "source": "manual",
    "url": null,
    "observed_at": "2026-07-16T00:00:00Z",
    "ingested_at": "2026-07-16T10:00:00Z",
    "summary": "FICTIONAL FIXTURE — illustrative Founder Score for the invented Ferrite deal: 71 [58, 80], confidence medium, cold_start true (no prior fundraise, no prior company), rationale: shipping cadence (sig-002) and hackathon win (sig-003). Hand-written example of the founder.schema shape; NOT produced by the Memory layer (real Memory records live in memory/founders.json).",
    "raw_ref": null,
    "trust_tier": "reconstructed",
    "authority": "agent-derived",
    "dedupe_key": "founder-score:fndr-0001:2026-07-16",
    "contradicts": []
  }
]
